"type","code","score","sportsmen_count","equipment","description","image"
"flexibility","ASDF17","1.2","2","Полотно","Оба спортсмена: Фиксирующая намотка на стопах Проворот плеч  Ноги согнуты  ","https://admin.wafed.org/storage/elements/18691/image.webp"
"flexibility","ASF17","0.2","1","Полотно","Удержание разноименной ноги за головой ноги прямые  Возможно выполнять на разделенных/собранных полотнах","https://admin.wafed.org/storage/elements/19230/image.webp"
"flexibility","SDF17","0.8","2","Стропы","Верхний спортсмен: Удержание ноги за щиколотку Проворот плеч Корпус между строп Ноги прямые  Опора на стопы партнера  Нижний спортсмен: Вис на стопах Ноги прямые","https://admin.wafed.org/storage/elements/18777/image.webp"
"flexibility","SF17","0.4","1","Стропы","Руки прямые Зацеп стопами Прогиб корпуса","https://admin.wafed.org/storage/elements/19561/image.webp"
"flexibility","AHDF18","0.6","2","Кольцо","Верхний спортсмен: Упор прямыми руками в партнера  Нижний спортсмен: Вис на подмышечных впадинах Удержание ног в продольном шпагатной линии, колено согнуто","https://admin.wafed.org/storage/elements/18572/image.webp"
"flexibility","AHF18","0.4","1","Кольцо","Удержание одноименной ноги на участке от колена до щиколотки Ноги прямые Удержание без проворота плеч                                        Продольная шпагатная линия менее 180 градусов","https://admin.wafed.org/storage/elements/18855/image.webp"
"flexibility","ASDF18","1.2","2","Полотно","Верхний спортсмен: Удержание ноги за щиколотку Проворот плеч Корпус между полотен Нога согнута Опора на стопу партнера  Нижний спортсмен: Захват ног за щиколотки Ноги согнуты Проворот плеч","https://admin.wafed.org/storage/elements/18692/image.webp"
"flexibility","ASF18","0.2","1","Полотно","Продольный шпагат 180 градусов и более на задней ноге спиральная намотка выполняется после циклического вращения","https://admin.wafed.org/storage/elements/19231/image.webp"
"flexibility","SDF18","0.8","2","Стропы","Верхний спортсмен: Продольная шпагатная линия  Удержание одноименной ноги за щиколотку   Проворот плеч  Верхняя нога согнута Опора на бедро партнера   Нижний спортсмен: Продольный шпагат 180 градусов и более Руки прямые Удержание строп руками  Корпус перпендикулярно полу","https://admin.wafed.org/storage/elements/18778/image.webp"
"flexibility","SF18","0.4","1","Стропы","Продольный шпагат 180 градусов и более Ноги прямые Руки прямые","https://admin.wafed.org/storage/elements/19562/image.webp"
"flexibility","AHDF19","0.6","2","Кольцо","Верхний спортсмен: Продольный шпагат 180 градусов и более Рука не удерживает стропу  Нижний спортсмен: Распор на бёдрах Руки не на снаряде","https://admin.wafed.org/storage/elements/18573/image.webp"
"flexibility","AHF19","0.4","1","Кольцо","Прогиб в спине Стопы  касаются лба/лица Выведение кольца вперед","https://admin.wafed.org/storage/elements/18856/image.webp"
"flexibility","ASDF19","1.2","2","Полотно","Верхний спортсмен: Любая фиксирующая намотка  Нижний спортсмен: Прогиб корпуса Удержание ног за щиколотки Ноги согнуты Проворот плеч ","https://admin.wafed.org/storage/elements/18693/image.webp"
"flexibility","ASF19","0.2","1","Полотно","Раскрытие ног в складку Опорная рука прямая свободная рука не на снаряде","https://admin.wafed.org/storage/elements/19232/image.webp"
"flexibility","SDF19","0.8","2","Стропы","Верхний спортсмен: Любая фиксирующая намотка Удержание партнёра двумя руками  Нижний спортсмен: Удержание ног за щиколотки Проворот плеч Ноги согнуты","https://admin.wafed.org/storage/elements/18779/image.webp"
"flexibility","SF19","0.6","1","Стропы","Вис в петле на пояснице/талии Удержание ног за щиколотки Ноги согнуты Проворот плеч Руки прямые","https://admin.wafed.org/storage/elements/19563/image.webp"
"flexibility","AHDF20","0.6","2","Кольцо","Оба спортсмена Вис под коленом на нижней дуге  Удержание прямой ноги                                           Проворот плеч  ","https://admin.wafed.org/storage/elements/18574/image.webp"
"flexibility","AHF20","0.4","1","Кольцо","Удержание ноги с проворотом плеч Ноги согнуты Линия раскрытия ног от колена до колена 180 градусов и более","https://admin.wafed.org/storage/elements/18857/image.webp"
"flexibility","ASDF20","1.4","2","Полотно","Верхний спортсмен: Удержание ноги за щиколотку Проворот плеч Корпус между полотен Ноги прямые Опора стопой  на стопу партнера  Нижний спортсмен: Захват ног за щиколотки Ноги согнуты Проворот плеч ","https://admin.wafed.org/storage/elements/18694/image.webp"
"flexibility","ASF20","0.2","1","Полотно","Продольный шпагат 180 градусов и более Рука удерживает полотно Свободная рука в сторону","https://admin.wafed.org/storage/elements/19233/image.webp"
"flexibility","SDF20","1","2","Стропы","Верхний спортсмен: Опора на партнера  Продольный шпагат 180 градусов и более  Проворот плеч  Удержание ноги за щиколотку   Ноги прямые   Нижний спортсмен:  Вис в подмышечных впадинах и коленных сгибах на разделенных стропах Допускается удерживать одной рукой ногу партера","https://admin.wafed.org/storage/elements/18780/image.webp"
"flexibility","SF20","0.6","1","Стропы","Поперечный шпагат 180 градусов и более Руки прямые Без дополнительных фиксаций","https://admin.wafed.org/storage/elements/19564/image.webp"
"flexibility","AHDF21","0.6","2","Кольцо","Верхний спортсмен: Упор прямыми руками в партнера  Нижний спортсмен: Вис на подмышечных впадинах Удержание ног в продольном шпагате 180 градусов и более","https://admin.wafed.org/storage/elements/18575/image.webp"
"flexibility","AHF21","0.4","1","Кольцо","Удержание прямой  ноги без проворота плеч Продольный шпагат 180 градусов и более   Удержание ноги на участке от колена до щиколотки","https://admin.wafed.org/storage/elements/18858/image.webp"
"flexibility","ASDF21","1.4","2","Полотно","Верхний спортсмен: Любая фиксирующая намотка  Нижний спортсмен:  Прогиб корпуса Удержание ног за щиколотки Ноги прямые Проворот плеч ","https://admin.wafed.org/storage/elements/18695/image.webp"
"flexibility","ASF21","0.4","1","Полотно","Продольный шпагат 180 градусов и более","https://admin.wafed.org/storage/elements/19234/image.webp"
"flexibility","SDF21","1","2","Стропы","Верхний спортсмен:  Продольная шпагатная линия (допускается 180 градусов и более) Удержание одноименной ноги за щиколотку   Проворот плеч  Ноги прямые   Нижний спортсмен: Продольный шпагат 180 градусов и более Руки прямые Корпус перпендикулярно полу","https://admin.wafed.org/storage/elements/18781/image.webp"
"flexibility","SF21","0.6","1","Стропы","Руки согнуты Проворот плеч Стопы касаются плеч Удержание за щиколотки","https://admin.wafed.org/storage/elements/19565/image.webp"
"flexibility","AHDF22","0.8","2","Кольцо","Оба спортсмена: Прогиб в спине Упор ногами в кольцо ","https://admin.wafed.org/storage/elements/18576/image.webp"
"flexibility","AHF22","0.4","1","Кольцо","Удержание ногой боковой дуги Ноги согнуты             Удержание за щиколотку            ","https://admin.wafed.org/storage/elements/18859/image.webp"
"flexibility","ASDF22","1.4","2","Полотно","Верхний спортсмен Продольный шпагат 180 градусов и более Руки прямые                          Упор стопой в партнера         Нижний спорстмен:  Продольный шпагат 180 градусов и более Руки прямые                          ","https://admin.wafed.org/storage/elements/18696/image.webp"
"flexibility","ASF22","0.4","1","Полотно","Поперечный шпагат 180 градусов и более Вторая рука удерживает снаряд Поперечная линия ровная","https://admin.wafed.org/storage/elements/19235/image.webp"
"flexibility","SDF22","1","2","Стропы","Оба спортсмена: Удержание одноименной ноги за щиколотку Продольный шпагат 180 градусов и более","https://admin.wafed.org/storage/elements/18782/image.webp"
"flexibility","SF22","0.6","1","Стропы","Спиральная намотка на бедре Раскрытие продольного шпагата 180 градусов и более Удержание ноги за щиколотку Рука за головой","https://admin.wafed.org/storage/elements/19566/image.webp"
"flexibility","AHDF23","0.8","2","Кольцо","Верхний спортсмен: Продольный шпагат 180 градусов и более Верхняя нога под кольцом    Упор ногой в кольцо  Нижний спортсмен: Прогиб корпуса Удержание ноги партнера Руки прямые","https://admin.wafed.org/storage/elements/18577/image.webp"
"flexibility","AHF23","0.4","1","Кольцо","Удержание ноги разноименной рукой за головой.                                   Удерживаемая нога прямая.   Удержание за щиколотку","https://admin.wafed.org/storage/elements/18860/image.webp"
"flexibility","ASDF23","1.4","2","Полотно","Верхний спортсмен: Удержание ноги за щиколотку Корпус между полотен Нога прямая Опора на стопу партнера  Нижний спортсмен: Захват ног за щиколотки Ноги прямые Проворот плеч","https://admin.wafed.org/storage/elements/18697/image.webp"
"flexibility","ASF23","0.4","1","Полотно","Удержание ноги за щиколотку Проворот плеч Ноги согнуты руки согнуты Возможно выполнять на разделенных/собранных полотнах","https://admin.wafed.org/storage/elements/19236/image.webp"
"flexibility","SDF23","1","2","Стропы","Верхний спортсмен:  Упор стопами с стропы  Продольный шпагат 180 градусов и более   Нижний спортсмен: Точка опоры под икроножной мышцей Продольный шпагат 180 градусов и более  Руки на снаряде ","https://admin.wafed.org/storage/elements/18783/image.webp"
"flexibility","SF23","0.6","1","Стропы","Вис на бедре Раскрытие продольного шпагат 180 градусов и более Удержание ноги за щиколотку Рука за головой","https://admin.wafed.org/storage/elements/19567/image.webp"
"flexibility","AHDF24","0.8","2","Кольцо","Верхний спортсмен: Удержание ноги партнера одной рукой  Нижний спортсмен: Продольный шпагат 180 градусов и более Руки на снаряде","https://admin.wafed.org/storage/elements/18578/image.webp"
"flexibility","AHF24","0.4","1","Кольцо","Вис на верхней дуге Проворот плеч Удержание ног за взъемы/щиколотки","https://admin.wafed.org/storage/elements/18861/image.webp"
"flexibility","ASDF24","1.4","2","Полотно","Верхний спортсмен: Любая фиксирующая намотка Удержание скрещенными руками  Нижний спортсмен: Зацеп за плечи партнера Удержание руками за руки партнера Ноги прямые                         Проворот плеч","https://admin.wafed.org/storage/elements/18698/image.webp"
"flexibility","ASF24","0.4","1","Полотно","Проворот плеч Удерживаемая нога согнута Удержание разноименной ноги Удержание ноги за щиколотку","https://admin.wafed.org/storage/elements/19237/image.webp"
"flexibility","SDF24","1.2","2","Стропы","Верхний спортсмен: Продольная шпагатная линия (допускается 180 градусов и более) Удержание разноименной ноги за щиколотку   Проворот плеча Руки прямые   Нижний спортсмен: Продольный шпагат 180 градусов и более Руки прямые Удержание строп руками   ","https://admin.wafed.org/storage/elements/18784/image.webp"
"flexibility","SF24","0.6","1","Стропы","Вис на локтевом сгибе Удержание согнутой ноги в положении бильман Проворот плеча Удержание нога за щиколотку","https://admin.wafed.org/storage/elements/19568/image.webp"
"flexibility","AHDF25","1","2","Кольцо","Верхний спортсмен: Продольная шпагатная линия менее 180 градусов  Нижний спортсмен: Проворот плеча Бильма Нога согнута                           Удержание за щиколотку","https://admin.wafed.org/storage/elements/18579/image.webp"
"flexibility","AHF25","0.4","1","Кольцо","Руки прямые Ноги прямые Прогиб в спине","https://admin.wafed.org/storage/elements/18862/image.webp"
"flexibility","ASDF25","1.4","2","Полотно","Верхний спортсмен: Продольный шпагат 180 градусов и более Руки не на снаряде  Нижний спортсмен: Продольный шпагат 180 градусов и более Руки прямые Удержание хвостов полотен Корпус перпендикулярно полу","https://admin.wafed.org/storage/elements/18699/image.webp"
"flexibility","ASF25","0.4","1","Полотно","Прогиб корпуса удержание ног за щиколотки Проворот плеч","https://admin.wafed.org/storage/elements/19238/image.webp"
"flexibility","SDF25","1.2","2","Стропы","Верхний спортсмен: Любая фиксирующая намотка Удержание партнёра двумя руками  Нижний спортсмен: Удержание ног за щиколотки Проворот плеч Ноги прямые","https://admin.wafed.org/storage/elements/18785/image.webp"
"flexibility","SF25","0.6","1","Стропы","Продольный шпагат 180 градусов и более Перекрещенные на пояснице стропы Удержание снаряда не обязательно","https://admin.wafed.org/storage/elements/19569/image.webp"
"flexibility","AHDF26","1","2","Кольцо","Верхний спортсмен: Руки прямые Удержание ног партнера  Нижний спортсмен: Руки прямые Удержание ног партнера Кольцо над ногами","https://admin.wafed.org/storage/elements/18580/image.webp"
"flexibility","AHF26","0.4","1","Кольцо","Удержание ног с проворотом плеч Руки прямые                            Возможно выполнять как на верхней, так и на нижней дуге.","https://admin.wafed.org/storage/elements/18863/image.webp"
"flexibility","ASDF26","1.4","2","Полотно","Оба спортсмена: Фиксирующая намотка на стопах Проворот плеч  Ноги прямые","https://admin.wafed.org/storage/elements/18700/image.webp"
"flexibility","ASF26","0.4","1","Полотно","Удержание ноги за щиколотку Проворот плеч Нижняя нога согнута","https://admin.wafed.org/storage/elements/19239/image.webp"
"flexibility","SDF26","1.2","2","Стропы","Оба спорстмена: Проворот плеч Удержание согнутой ноги  Свободная нога согнута","https://admin.wafed.org/storage/elements/18786/image.webp"
"flexibility","SF26","0.6","1","Стропы","Проворот плеч Удержание за щиколотку Нога согнута Руки прямые","https://admin.wafed.org/storage/elements/19570/image.webp"
"flexibility","AHDF27","1","2","Кольцо","Верхний спортсмен: Удержание одной рукой за стропу Ровная линия корпуса   Нижний спортсмен: Удержание кольца руками Нога между рук и кольцом Нижняя нога согнута","https://admin.wafed.org/storage/elements/18581/image.webp"
"flexibility","AHF27","0.4","1","Кольцо","Прямой хват на боковой дуге Корпус снаружи кольца Ноги прямые Прогиб корпуса","https://admin.wafed.org/storage/elements/18864/image.webp"
"flexibility","ASDF27","1.4","2","Полотно","Верхний спортсмен: Продольный шпагат 180 градусов и более Руки не на снаряде  Нижний спортсмен: Продольный шпагат 180 градусов и более Руки прямые Удержание хвостов полотен Корпус перпендикулярно полу","https://admin.wafed.org/storage/elements/18701/image.webp"
"flexibility","ASF27","0.4","1","Полотно","Продольный шпагат 180 градусов и более) Руки прямые Две руки на снаряде Передняя нога в петле","https://admin.wafed.org/storage/elements/19240/image.webp"
"flexibility","SDF27","1.2","2","Стропы","Оба спортсмена: Проворот плеч Удерживаемая нога согнута Опорная нога прямая  Удержание ноги за щиколотку 2 руками","https://admin.wafed.org/storage/elements/18787/image.webp"
"flexibility","SF27","0.6","1","Стропы","Удержание разноименной ноги Удержание за щиколотку Удерживаемая нога согнутая Проворот плеча","https://admin.wafed.org/storage/elements/19571/image.webp"
"flexibility","AHDF28","1","2","Кольцо","Верхний спортсмен: Упор в кольцо Удержание согнутой ноги  Проворот плеч Бильман  Нижний спортсмен: Вис в прогибе Удержание прямой ноги  Проворот плеч Бильман ","https://admin.wafed.org/storage/elements/18582/image.webp"
"flexibility","AHF28","0.4","1","Кольцо","Удержание ноги за щиколотку                             Проворот плеча Нижняя нога прямая","https://admin.wafed.org/storage/elements/18865/image.webp"
"flexibility","ASF28","0.4","1","Полотно","Продольный шпагат 180 градусов и более Полотна перекрещены на пояснице","https://admin.wafed.org/storage/elements/19241/image.webp"
"flexibility","SDF28","1.2","2","Стропы","Верхний спортсмен:    Продольный шпагат 180 градусов и более  Обе руки на снаряде  Нижний спортсмен: Точка опоры под икроножной мышцей  Продольный шпагат 180 градусов и более Проворот плеча                         Руки прямые Удержание одноименной ноги за щиколотку","https://admin.wafed.org/storage/elements/18788/image.webp"
"flexibility","SF28","0.6","1","Стропы","Линия раскрытия ног от колена до колена 180 градусов и более Точка опоры на двух бёдрах Удержание ноги за щиколотку Ноги согнуты Проворот плеч","https://admin.wafed.org/storage/elements/19572/image.webp"
"flexibility","AHDF29","1","2","Кольцо","Верхний спортсмен: Упор в кольцо Удержание прямой ноги  Без проворота плеч  Нижний спортсмен: Вис в прогибе Удержание согнутой ноги  Проворот плеч ","https://admin.wafed.org/storage/elements/18583/image.webp"
"flexibility","AHF29","0.4","1","Кольцо","Хват рук и зацеп ноги на нижней дуге Опорная нога  прямая Руки прямые","https://admin.wafed.org/storage/elements/18866/image.webp"
"flexibility","ASF29","0.4","1","Полотно","Продольный шпагат 180 градусов и более Зацеп стопой передней ноги Руки прямые","https://admin.wafed.org/storage/elements/19242/image.webp"
"flexibility","SDF29","1.4","2","Стропы","Верхний спорстмен: Проворот плеч Удерживаемая нога согнута Удержание ноги за щиколотку 2 руками Опорная нога прямая   Нижний спортсмен: Проворот плеч Ноги прямые Удержание ноги за щиколотку ","https://admin.wafed.org/storage/elements/18789/image.webp"
"flexibility","SF29","0.6","1","Стропы","Удержание ноги через бок Удержание ноги за щиколотку Раскрытие продольного шпагата 180 градусов и более Удержание снаряда рукой","https://admin.wafed.org/storage/elements/19573/image.webp"
"flexibility","AHDF30","1","2","Кольцо","Оба гимнаста  Удержание двумя руками согнутой ноги  Свободная нога прямая над головой  Свободная нога между рук ","https://admin.wafed.org/storage/elements/18584/image.webp"
"flexibility","AHF30","0.4","1","Кольцо","Выворотный (обратный) хват Руки прямые","https://admin.wafed.org/storage/elements/18867/image.webp"
"flexibility","ASF30","0.4","1","Полотно","Проворот плеч Руки и ноги согнуты","https://admin.wafed.org/storage/elements/19243/image.webp"
